{
  "$schema": "https://json-schema.org/draft/2020-12/schema",
  "$id": "https://cloudsbeyond.github.io/visual-agent/protocol/schemas/scenario-manifest.schema.json",
  "title": "ScenarioManifest",
  "description": "L3 Scenario Manifest, currently named Scene Manifest by the desktop GUI reference runtime.",
  "type": "object",
  "required": ["schemaVersion", "scene", "profile", "intents"],
  "properties": {
    "schemaVersion": { "const": 1 },
    "scene": { "type": "string", "minLength": 1 },
    "profile": {
      "type": "object",
      "properties": {
        "bundleID": { "type": "string" },
        "ownerNames": {
          "type": "array",
          "items": { "type": "string", "minLength": 1 }
        },
        "appLabel": { "type": "string" }
      }
    },
    "intents": {
      "type": "object",
      "minProperties": 1,
      "additionalProperties": { "$ref": "#/$defs/intent" }
    }
  },
  "$defs": {
    "intent": {
      "type": "object",
      "required": ["required", "steps"],
      "properties": {
        "description": { "type": "string" },
        "required": {
          "type": "array",
          "items": { "type": "string", "minLength": 1 }
        },
        "defaults": { "type": "object" },
        "paramTypes": {
          "type": "object",
          "additionalProperties": {
            "type": "string",
            "enum": ["string", "number", "integer", "boolean", "array", "object"]
          }
        },
        "steps": {
          "type": "array",
          "minItems": 1,
          "items": { "$ref": "#/$defs/step" }
        }
      }
    },
    "step": {
      "type": "object",
      "required": ["type"],
      "properties": {
        "type": {
          "type": "string",
          "enum": ["click", "scroll", "keypress", "wait", "screenshot", "type", "drag", "move", "double_click"]
        },
        "fields": { "type": "object" }
      }
    }
  }
}
